Name,Birthday,CountriesActive,YearsActive,ProvenVictims,PossibleVictims,Notes,Type,Nickname
Henry Lee Lucas,8/23/1936,United States,1960-1983,11,40,"His father, Anderson Lucas, an alcoholic and former railroad employee who had lost his legs in a train accident. His mother, Viola Lucas, a local prostitute who was violent to Henry. His mother and father abused alcohol and/or drugs. He had a head injury as well as a physically defect. Although he confessed to over 3,000 murders most are belived to be false confessions. Lucas befriended fellow serial killer Ottis Toole, and settled in Jacksonville, Florida where he lived with Toole's parents. On March 12, 2001, Henry Lee Lucas was found dead in prison from heart failure.","Necrophiliac, Rapist, Strangler","The Confession Killer, The Highway Stalker"
Ondrej Rigo,12/17/1955,"Germany, Slovakia",1990-1992,9,9,He was arrested in 1992 and received a life sentence in 1994. He remains the murderer with the biggest number of victims in the modern history of Slovakia.,Necrophiliac,Slovakia Gypsy
Genzo Kurita,11/3/1926,Japan,1948-1952,8,8,"In 1948, Kurita murdered three victims, one was pregnant, he committed acts of necrophilia on her body. In 1951, Kurita threw three children off a cliff, the children of a woman he had murdered, one child survived the fall. In 1959, Genzo Kurita was executed by hanging.","Necrophiliac, Rapist",
John Christie,4/8/1899,United Kingdom,1943-1953,8,8,"He had a speech defect, and was impotent.","Rapist, Necrophiliac, Strangler",The Rillington Place Strangler
Eric Edgar Cooke,2/25/1931,Australia,1959-1963,8,8,"He was known to kill at the home of the victim. He positioned or posed at least one body after death. At the time of his crimes he was living with his wife and seven children, where Cooke was known to work as a serial killer.","Rapist, Necrophiliac, Strangler",The Night Caller
Yoshio Kodaira,8/20/1946,Japan,1928-1946,8,11,"Kodaira killed his father-in-law in 1932 and eight to ten women in Japan between 1945 and 1946. In the 1920s, Kodaira was deployed to Northern China as a sailor in the Imperial Japanese Navy to participated in the Jinan incident.","Rapist, Necrophiliac, Strangler",
Anatoly Slivko,12/28/1985,Russia,1961-1985,7,7,"Slivko was a member of the Young Pioneers (Soviet Boy Scouts), he gained the trust of forty-three young boys over almost three decades, asphyxiated them until they fell unconscious, ritually molested, filmed, photographed and resuscitated them. The seven boys that did not wake up were dismembered and burned.","Rapist, Necrophiliac, Strangler, Pedophile",
Doug Clark,3/10/1948,United States,1980,6,6,"His father, Franklin Clark, a Naval Intelligence officer.","Necrophiliac, Rapist",One of Sunset Strip Killers
Carol M. Bundy,8/26/1942,United States,1980,2,6,Carol M. Bundy an American serial killer. Bundy and Doug Clark became collectively known as the Sunset Strip Killers after being convicted of a series of murders in Los Angeles during the late spring and early summer of 1980. The victims were young sex workers or runaways.,,One of Sunset Strip Killers
Wolfgang Schmidt,10/5/1966,Germany,1989-1991,6,6,"Schmidt legally changed his name to Beate Schmidt in 2001. In 2009, Schmidt underwent a hormone treatment for gender reassignment and is now a trans woman. He was arrested after two joggers found Schmidt masturbating in the woods while wearing a bra. In 1992, Wolfgang Schmidt was sentenced to a fifteen year sentence at a psychiatric hospital in Brandenburg an der Havel, a town in Brandenburg, Germany.","Rapist, Necrophiliac, Strangler","Beast of Beelitz, the Pink Giant Beate Schmidt"
Rory Enrique Conde,6/14/1965,United States,1994-1995,6,6,"Conde killed six prostitutes in Florida, he strangled his victims to death and would have anal sex with the corpses afterward. After killing his third victim Conde left a note reading: ""Third, I will call Dwight Channel 10, see if you can catch me"". ","Rapist, Necrophiliac, Torturer, Strangler",The Tamiami Trail Strangler
Richard Trenton Chase,5/23/1950,United States,1977,6,6,"He was convicted of six murders performed in the span of a month after being released of a psychiatric hospital where he had been committed for killing and eating the raw meat of several animals. In addition to killing his victims, he often raped the women's bodies and sometimes drank their blood, or took their organs home and ate them.","Vampire, Rapist, Cannibal, Necrophiliac",Vampire of Sacramento
Ladislav Hojer,3/15/1958,Czech Republic,1978-1981,5,7,"He cut off the breasts, vulva and genitalia of one of his victims. Hojer later committed acts of necrophilia on the genitalia before cooking the victims body parts in salt water and committed acts of cannibalism on them. In 1982, Hojer was arrested after a mentally-ill friend who Hojer had shown the scene of the crime, mistakingly confessed to the crime even though he was incarcerated at the time.","Rapist, Necrophiliac, Strangler, Cannibal",Cowardly Cannibal
Cory Deonn Morris,5/10/1978,United States,2002-2003,5,6,"Morris was convicted of luring five women to a camper, strangling them during sex and dumping their bodies. Morris is reported to have kept the victims body for some time, committing act of necrophilia on the lifeless bodies.","Rapist, Necrophiliac, Strangler","Huggy Bear, Teddy Bear, Crackhead Killer"
Bernard Giles,4/9/1953,United States,1973,5,5,"Bernard Giles was sentenced to life in prison in 1977. In 2019, Giles was interviewed by Piers Morgan as part of a documentary series on ITV called Confessions Of A Serial Killer With Piers Morgan.","Rapist, Necrophiliac, Strangler, Pedophile",
Anatoly Biryukov,2/18/1944,Russia,1977,5,5,"Biryukov was convicted for kidnapping, raping and subsequent murder of five infants from Moscow in the fall of 1977. Biryukov abducted his victims and committed violent sexual intercourse with the infants before murdering and discarding the body. Biryukov attempted multiple failed suicides while awaiting execution. In 1979, Anatoly Biryukov was executed by firing squad.","Rapist, Necrophiliac, Pedophile",The Baby Hunter
Danny Rolling,5/26/1954,United States,1989-1990,5,8,"In 1990, Rolling attempted to kill his father during a family argument in which his father lost an eye and an ear. He was executed by lethal injection in 2006. Shortly before his execution, he gave a handwritten confession to authorities for the triple homicide of an elderly man, his daughter, and grandson that occurred years earlier in Rolling's hometown of Shreveport, Louisiana.","Rapist, Necrophiliac",Gainesville Ripper
Tsutomu Miyazaki,8/21/1962,Japan,1988-1989,4,4,"Miyazaki murdered four girls aged between four and seven. He mutilated and sexually molested the corpse of at least one of his victims. He drank the blood of at least one victim and ate her hands. A premature birth left him with deformed hands, which were permanently fused directly to the wrists. Miyazaki blamed his actions on Rat Man, an alter ego who he claimed forced him to kill. Miyazaki drew pictures of Rat Man during his trial. Miyazaki's father committed suicide after hearing of his son's actions.","Rapist, Vampire, Cannibal, Necrophiliac, Strangler","The Otaku Murderer, The Little Girl Murderer"
Thor Nis Christiansen,12/28/1957,United States,1976-1979,4,4,"Christiansen shot and committed acts of necrophilia on four young women in Isla Vista, California between 1976 and 1979. In 1979, An additional intended victim escaped with a bullet in her head, and later identified him in a Los Angeles bar which led to his arrest. Christiansen was sentenced to life in prison in 1980. In 1981, Thor Nis Christiansen was stabbed to death by an unidentified fellow inmate at Folsom State Prison.","Rapist, Necrophiliac",The Hitchhiker Slayer
Lam Kor-wan,3/22/1955,Hong Kong,1980,4,4,"Lam worked as a taxi driver, he would pick up female passengers, strangle them with electrical wire and take them to his family home to dismember them. Lam Kor-wan was known to commit act of necrophilia with some of the bodies and he kept body parts in his parents' home, including sexual organs in plastic containers found in his room.","Rapist, Necrophiliac, Strangler","The Jars Murderer, The Rainy Night Butcher"
Peter Woodcock,3/5/1939,Canada,1956-1991,4,4,"Woodcock was a sexual sadist who killed three young children in Toronto in the 1950s. He was sentenced to a psychiatric facility, where he murdered a fellow inmate while on unsupervised release in 1991. Once captured Woodcock stated ""My fear was that Mother would find out. Mother was my biggest fear. I didn’t know if the police would let her at me."" On March 5th 2010, his 71st birthday, Krueger died of natural causes while in custody at Penetanguishene Mental Health Centre in Canada.","Rapist, Necrophiliac, Strangler, Pedophile",David Michael Krueger
Wayne Adam Ford,12/3/1961,United States,1997-1998,4,4,"Ford was arrested when he walked into the Humboldt County Sheriff Department in Eureka, California in 1998 with a woman's severed breast. He confessed to murdering four women and is believed to have killed others.","Rapist, Necrophiliac, Strangler",
Tony Costa,8/2/1944,United States,1968-1969,4,7,"Costa committed suicide by hanging himself in his cell at Massachusetts Correctional Institution in South Walpole, Massachusetts.","Rapist, Necrophiliac",
Bakhtiyor Matyakubov,N/A,Uzbekistan,2015,3,11,"Evidence against Matyakubov includes CCTV footage of him brutal killing a sex shop saleswoman at the Dzhaga-Dzhaga sex shop in Russia, the victim was stabbed twenty times during the attack. Matyakubov is later due to be extradited to his native Uzbekistan, where he’s accused of killing three more women. Matyakubov was reported to have decapitated at least one Uzbekistan victim before having sex her headless corpse.","Rapist, Necrophiliac",
Anthony Hardy,5/31/1951,United Kingdom,2000-2002,3,9,"He was diagnosed with a personality disorder and preventively detained in a mental institution until November 2002. In 2002 the dismembered remains of two women were found in trash bins. While arresting Hardy, an officer was stabbed in the hand and had his eye dislocated from his eye socket. He took numerous pornographic pictures of his victims after death prior to dismembering the bodies.","Rapist, Necrophiliac, Strangler",The Camden Ripper
Michael Madison,10/15/1977,United States,2012-2013,3,3,"In 2016, Michael Madison was sentenced to death, at his sentencing he was attacked by the father of one of his victims.","Rapist, Necrophiliac, Strangler",
Jack Spillman,8/30/1969,United States,1994-1995,3,3,"According to court documents, ""Spillman would declare to Miller (his cellmate) that he wanted to be the world’s greatest serial killer.""","Rapist, Necrophiliac, Torturer",The Werewolf Butcher
Dean Corll,12/24/1939,United States,1970-1973,28,29,"Corll along with two teenaged accomplices named David Owen Brooks and Elmer Wayne Henley, abducted, raped tortured and murdered at least twenty-eight young men between 1970 and 1973 in Houston, Texas. The crimes are known as the Houston Mass Murders. Corll and his family owned and operated a candy factory in Houston Heights, Texas. Dean Corll was murdered by his accomplice, Elmer Wayne Henley, after Corll had turned on him.","Rapist, Torturer, Strangler","Candy Man, Pied Piper"
Elmer Wayne Henley,5/9/1956,United States,1972-1973,6,6,"An American serial killer who was a participant in a series of murders known as the Houston Mass Murders in which a minimum of 28 teenage boys and young men were abducted, tortured raped and murdered by Dean Corll between 1970 and 1973.",,
Lydia Sherman,12/24/1825,United States,1863-1871,12,12,"Sherman poisoned three of her husbands and eight children in her care, six of which were her own and two step-children.",,The Derby Poisoner
Anatoly Utkin,1/1/1943,Russia,1968-1973,9,9,He killed eight girls and one man from 1968 to 1973. He was known to rape at least one of his victims. He had other charges including theft and robbery. He was found guilty on all counts and sentenced to death by firing squad.,Rapist,Ulyanovsky maniac
Kiyoshi Okubo,1/17/1935,Japan,1971,8,8,"Okubo raped and murdered eight women aged 16 to 21 in 1971. He was recently released from prison for previous rape charges. A brother of one of his victims located and turned Okubo's whereabouts to the police, his arrest followed. Kiyoshi Okubo was sentenced to death by hanging and executed in 1976.","Rapist, Strangler",
John Edward Robinson,12/27/1943,United States,1984-2000,8,8,"Robinson lured his victims through the internet via BDSM online chat rooms. In 1969, Robinson was arrested for the first time in Kansas City after embezzling money from a medical practice. From 1970 to 1979 he had several other charges including embezzlement, check forgery and mail fraud. In 2000, Robinson was arrested after a woman filed a sexual battery complaint against him. He was found guilty of three murders and admitted responsibility for five additional murders. Robinson currently rema","Rapist, Torturer",The Slavemaster
Christopher Peterson,1/20/1969,United States,1990,7,7,"Later changed name Obadyah Ben-Yisrayl, confessed to shooting seven people with a shotgun in a killing spree spanning from October 30, 1990 to December 18, 1990 in Indiana. Sentenced to death, commuted to life.",,The Shotgun Killer
Rhonda Belle Martin,1/1/1907,United States,1937-1951,6,6,"Serial killer and poisoner who murdered six family members in Alabama. Martin was executed in Alabama's electric chair on October 11, 1957 at Kilby Prison in Montgomery, Alabama.",,
Aleksandr Rubel,12/25/1980,Estonia,1997-1998,6,7,"He was intoxicated on gasoline vapour during his murders, one of which his father was an accomplice. All six victims were stabbed, one was strangled one stoned and another hit with an axe. Rubel was taken in to custody as a juvenile on June 8th 1998, sentenced as a minor to the maximum punishment allowed by law, eight years imprisonment.",Strangler,Benzomaniac
Ian Brady,1/2/1938,United Kingdom,1963-1965,5,5,"He, along with his girlfriend, Myra Hindley, are known for committing the Moors murders. The Moors murders were carried out in England between 1963 and 1965. Five children were abducted and at least four were sexually assaulted. The victims were male and female children aged between 10 and 17.","Rapist, Torturer, Strangler",
Myra Hindley,7/23/1942,United Kingdom,1963-1965,5,5,"She, along with her boyfriend, Ian Brady, are known for committing the Moors murders. The Moors murders were carried out in England between 1963 and 1965. Five children were abducted and at least four were sexually assaulted. The victims were male and female children aged between 10 and 17.","Rapist, Torturer, Strangler",
Cynthia Coffman,1/19/1962,United States,1986,5,5,"Cynthia Coffman girlfriend of James Gregory Marlow an American serial killer known as The Folsom Wolf. Coffman has a tattoo that reads, Property of the Folsom Wolf. They targeted female victims who had just withdrawn cash from ATM machines. They strangled 4 such victims to death, 2 of which were brutally sexually assaulted. Marlow and Coffman both sentenced to death with the addition of a life sentence atop their death penalties.",Strangler,Property of the Folsom Wolf
Ray Copeland,12/30/1914,United States,1986-1989,5,12,"Ray Copeland is an American serial killer who with his wife Faye Copeland became the oldest couple ever sentenced to death in the United States. They were convicted of killing five drifters at their farm in Mooresville, Missouri.",,
Faye Copeland,8/4/1921,United States,1986-1989,5,12,"Faye Copeland (born Faye Della Wilson) is an American serial killer who with her husband Ray Copeland became the oldest couple ever sentenced to death in the United States. They were convicted of killing five drifters at their farm in Mooresville, Missouri.",,
Claude Lastennet,1/19/1971,France,1993-1994,5,5,Lastennet was convicted of murdering five old women between August 1993 and January 1994.,,
Phillip Carl Jablonski,1/3/1946,United States,1978-1991,5,5,,,
Janie Lou Gibbs,12/25/1932,United States,1966-1967,5,5,"Gibbs killed five of her family members. Gibbs killed her three sons, a grandson and her husband, by poisoning them with arsenic between 1966 and 1967 in Cordele, Georgia. She was sentenced to five life terms in prison. She was released from prison in 1999 due to being diagnosed with Parkinson's disease.",,"The Georgian Black Widow, the Black Georgia Peach"
Vincent Johnson,1/6/1969,United States,1999-2000,5,6,"His victims were strangled and at least three were sexually assaulted by Johnson. He was described by police as a homeless panhandler and crack addict. His DNA was found on four of the victims, which lead to his arrest for the murders. Johnson confessed to the murders a week before prosecutors were to decide on whether or not to seek the death penalty.","Rapists, Strangler","The Brooklyn Strangler, The Williamsburg Strangler"
Hiroaki Hidaka,1/1/1962,Japan,1996,4,4,"Taxi driver who strangled four prostitutes to death in 1996. He buried the remains in the mountains near Hiroshima, Japan. One of his victims was a 16-year-old girl.",Strangler,
Wayne Boden,1/1/1948,Canada,1968-1971,4,4,"Boden killed four women between 1968 and 1971 in Montreal and Calgary, Canada. He would rape and strangle his victims. He was known to bite the breasts of at least three of his victims. Boden was the first murderer to be convicted in North America based on odontological evidence.","Rapist, Strangler, Vampire",The Vampire Rapist
James Vlassakis,12/24/1979,Australia,1997-1999,4,4,"The Snowtown murders (also known as the bodies-in-barrels murders) were a series of murders committed by Vlassakis, Bunting, and Robert Joe Wagner between 1992 and 1999.",,
Buddy Earl Justus,12/25/1952,United States,1978,3,4,"In 1978, Justus raped and murdered an eight and a half month pregnant nurse by shooting her three times in the head. In 1978, Justus and a hitchhiker named Dale Dean Goins, kidnapped raped and murdered two victims before dumping the bodies.",Rapist,
Patrick McCullough,1/20/1960,United States,1980-2001,3,3,,,The Deaf Serial Killer
Jose Rodriguez,1/19/1972,United States,2018,3,3,,Rapist,
Israel Keyes,1/7/1978,United States,1998-2012,3,11,"An FBI report said Keyes burglarized twenty to thirty homes and robbed several banks between 2001 and 2012. He may be linked to as many as eleven deaths. Keyes planned murders long ahead of time, usually killed far from home, and never in the same area twice. Keyes committed suicide on December 2nd 2012, via self-inflicted wrist cuts and strangulation at Anchorage Correctional Complex.","Rapist, Strangler",Izzy
Ozgur Dengiz,1/1/1984,Turkey,2007,3,3,Interned in a mental institution after his conviction to two life sentences was overturned.,Cannibal,The Cannibal of Ankara
George Joseph Smith,1/11/1872,United Kingdom,1912-1914,3,3,"Known for ""The Brides in the Bath Murders"".",,
Altemio Sanchez,1/19/1958,United States,1981-2006,3,3,"He would beat and raped his victims before using a ligature, wire, or garrote, to strangle and suffocate victims.","Rapist, Strangler","Bike Path Rapist, Bike Path Killer"
Michael Bruce Ross,7/26/1959,United States,1981-1984,8,8,,"Rapist, Strangler, Torturer, Stalker",The Roadside Strangler
Marie Noe,8/23/1928,United States,1949-1968,8,8,She who murdered eight of her children between 1949 and 1968.,,
Kendall Francois,7/27/1971,United States,1996-1998,8,9,"Francois confessed to killing eight prostitutes in Poughkeepsie, New York, but denied involvement with the disappearance of a ninth prostitute. In 1995, Francois tested positive for HIV. He hid the bodies of his victims in the house that he shared with his parents.","Rapist, Strangler, Stalker",The Poughkeepsie Killer
Walter E. Ellis,7/24/1960,United States,1986-2007,7,20,"Ellis was convicted of killing seven prostitutes in Wisconsin between 1986 and 2007. His victims were all African-American women. In 2011, investigators stated they were reviewing the cases of another twenty strangled prostitutes Elis could be connected to.","Rapist, Strangler",The Milwaukee North Side Strangler
Paul Durousseau,8/11/1970,United States,1997-2004,7,9,"Durousseau murdered seven young women, including two who were pregnant, in the southeastern United States. He would gain entrance to the victim's home, bound, rape and strangle the victims to death.","Rapist, Strangler",The Jacksonville Strangler
David Alan Gore,8/21/1953,United States,1981-1983,6,6,"Gore had an accomplice, his cousin Fred Waterfield, and the pair were dubbed the Killing Cousins. David Alan Gore was executed by lethal injection at 6:19 p.m. on Thursday, April 12, 2012, having exhausted all legal appeals.","Rapist, Torturer, Strangler, Stalker",One of the The Killing Cousins
Fred Waterfield,9/29/1952,United States,1981-1983,6,6,"Fred Waterfield (Frederick Levin Waterfield) an American serial killer known as The Killing Cousins. The Killing Cousins confessed to, and was convicted of, six murders in Vero Beach and Indian River County, Florida in the 1980s. Waterfield had an accomplice, his cousin David Alan Gore, and the pair were dubbed the Killing Cousins. Gore was executed by lethal injection in 2012. In 1985, Waterfield was convicted of two murders and sentenced to life imprisonment. Fred Waterfield is currently serving two consecutive life sentences at the Avon Park Correctional Institution in Florida.","Rapist, Torturer, Strangler, Stalker",One of the The Killing Cousins
Cleophus Prince,7/24/1967,United States,1990,6,6,"He would break into homes to rape stab and murder his victims, he stole the wedding rings of some of his victims. In 1991, Prince's license plate number was taken down by a potential victims neighbor which led to his arrest, he was released on bail. In 1991, Prince walked into the precinct with his mother and he was taken into custody after authorities requested he come in to fill out additional paperwork.","Rapist, Stalker",The Clairemont Killer
Lemuel Smith,7/23/1941,United States,1958-1981,6,6,"Lemuel Smith Confessed to the murders of five people, including an on-duty female prison guard. Sentenced to death on June 10, 1983. Conmmuted to life in 1984.",,
Nathaniel White,7/28/1960,United States,1991-1992,6,6,"White was convicted of beating and stabbing to death six women in the Hudson Valley region of New York. White claims to have been inspired by the 1990 movie RoboCop 2, basing his first murder after a scene from the movie.",Rapist,
John George Haigh,7/24/1909,United Kingdom,1944-1949,6,9,"Known as the Acid Bath Murderer for dissolving his victims in sulphuric acid under the belief that he could not be prosecuted for murder if no body was found. He would then forge papers to sell the victims possessions. Confessed nine murders, convicted of six and hanged. Haigh claimed that he had drank the blood of one of his victims.",Vampire,Acid Bath Murderer
Willem van Eijk,8/13/1941,Netherlands,1971-2001,5,8,"He was an outcast from early elementary school, being publicly bullied and showing several acts of animal cruelty.","Rapist, Strangler","The Beast of Harkstede, Gekke Willempje"
Shawn Grate,8/8/1976,United States,2005-2016,4,5,"He was arrested after a victim who was kidnapped and raped multiple times escaped and called 911. Grate wrote two letters to a news station in Cleveland, Ohio confessing to the murders of all five victims.","Rapist, Strangler",
Thomas Huskey,8/20/1960,United States,1991-1992,4,4,Huskey confessed and had souvenirs from the women's bodies found in his bedroom. He was charged with four murders which were formally dropped due to a mistrial. Huskey is a former elephant trainer who got his nickname from prostitutes who said he took them to the Knoxville Zoo to have sex.,Rapist,Zoo Man
Fritz Honka,7/31/1935,Germany,1971-1974,4,4,"Honka murdered four women working as prostitutes in Hamburg and kept the bodies in his apartment. Honka sawed the corpses into pieces, wrapped them in plastic and hid pieces in various places around Ottensen including his own attic. In 1975, the apartment building where Honka lived caught fire and exposed a partially decomposed female torso in a plastic bag which prompted the police to search the building.",Strangler,Peter Jensen
Cary Stayner,8/13/1961,United States,1999,4,4,"Stayner was frequent at Laguna Del Sol, a nudist colony in Sacramento County. He was arrested at Laguna Del Sol in 1999 after witnesses identified his vehicle to authorities.","Rapist, Strangler, Stalker",The Yosemite Killer
Robert Rozier,7/28/1955,United States,1981-1986,4,7,"Rozier was a former American football defensive end who played in the National Football League and Canadian Football League. He was as a member of the Nation of Yahweh, a black supremacist cult. The Yahweh's group required murdering a ""white devil"" and returning with a body. Rozier confessed to killing seven white people to please Yahweh.",,"Neariah Israel, Child of God"
Hiroshi Maeue,8/8/1968,Japan,2005,3,3,"Maeue found his victims in an online suicide community. He offered to painlessly kill themselves together by charcoal burning in a car, but once together he strangled them with his bare hands instead, as this excited him sexually. Maeue suffered from a psychosexual disorder which made him unable to achieve sexual release in the absence of performing an act of strangulation. ",Strangler,The Suicide Website Murderer
Yukio Yamaji,8/21/1983,Japan,2000-2005,3,3,Murdered his own mother in 2000. Yamaji also murdered a 27-year-old woman and her 19-year-old sister in 2005.,Rapist,
