Name,Birthday,CountriesActive,YearsActive,ProvenVictims,PossibleVictims,Notes,Type,Nickname
Fred West,9/29/1941,United Kingdom,1967-1987,12,13,"Rosemary West (born Rosemary Pauline Letts) a British serial killer who along with her husband Fred West are known as The Gloucester House of Horrors. In 1995, Fred and Rosemary were convicted of ten murders, nine young women between 1973 and 1987, and her own son in 1971. The majority of these murders were committed at the couple's home, 25 Cromwell Street in Gloucester, England. Found guilty and sentenced to life imprisonment.","Rapist, Strangler, Torturer",
Paul Ogorzow,9/29/1912,Germany,1940-1941,8,8,"Ogorzow was a Sturmabteilung sergeant convicted of raping and murdering eight women by throwing them off trains in Berlin during wartime blackouts in 1941 and 1942. He worked on The Deutsche Reichsbahn, also known as the German National Railway. Most of his victims were married women whose husbands were away serving in the military.","Rapist, Strangler",S-Bahn murderer
Dayton Leroy Rogers,9/30/1953,United States,1983-1987,7,8,"Rogers killed street women, usually addicts, prostitutes and runaways. He picked up prostitutes and took them to secluded areas. He would bound, torture rape and murder his victims, leaving the bodies in a forest outside Molalla, Oregon. Authorities found the fingerprint of one of his victims on the door handle of his vehicle. Blood and numerous knife marks were found inside the cab of his vehicle.","Rapist, Torturer",Molalla Forest Murderer
Guy Georges,10/15/1962,France,1991-1997,7,7,"Georges assaulted, stabbed, tortured, raped and killed seven women in the neighborhood of the Bastille between 1991 and 1997. His mother abandoned him to state custody at the age of six, he was adopted by a family and grew up in a family of twelve adopted children. Georges’ DNA matched evidence found at all four crime scenes, as well as at one attempted rape.","Rapist, Torturer","The Beast of the Bastille, the killer of eastern Paris"
Vaclav Mrazek,10/22/1925,Czech Republic,1951-1956,7,7,"A Czech serial killer who killed six women and one man in Chomutov. He would rape rob, beat, shoot and murder his victims. He had an extensive criminal history prior to his killing spree. In 1951, Mrazekis is thought to have committed his first murder, the murder of a 15-year-old girl.",Rapist,
Carlton Gary,9/24/1950,United States,1975-1978,7,7,"Gary would beat, sexually assault and strangle elderly victims, mostly using stockings. An eighth elderly women was beat and sexually assaulted but survived the attack. Gary was convicted of the murders of seven elderly women in Georgia and sentenced to death on August 27th 1986. On March 15th 2018, Carlton Gary was executed by lethal injection at Georgia Diagnostic and Classification State Prison in Jackson, Georgia.","Rapist, Strangler","The Stocking Strangler, Steakhouse Bandit"
Juan Díaz de Garayo,10/17/1821,Spain,1870-1879,6,6,"Garayo strangled six victims and attacked four others between 1870 and 1879. Garayo first killed prostitutes after hiring and sleeping with them consensually, but grew more violent, attacking, raping and murdering his victims.","Rapist, Strangler","The Fat Extractor (""El Sacamantecas"")"
Lyda Southard,10/16/1892,United States,1915-1920,6,6,"Lyda Southard (Lyda Anna Mae Trueblood) an American serial killer who poisoned her 4 husbands, a brother-in-law, and her daughter by using arsenic poisoning derived from flypaper. Southard died of a heart attack on February 5, 1958 in Salt Lake City, Utah.",,"Flypaper Lyda, The Black Widow"
Mack Ray Edwards,10/17/1918,United States,1953-1970,6,18,"An American serial killer and child molester who murdered at least six children in Los Angeles County, California between 1953 and 1970. Edwards murdered at least two young girls and four young boys. He claimed at one point to have killed as many as eighteen victims. Edwards pleaded guilty to three counts of murder and was sentenced to death. In 1971, Mack Ray Edwards committed suicide by hanging himself with a television cord in his cell at San Quentin State Prison in San Quentin, California.","Rapist, Pedophile, Strangler",
Lawrence Bittaker,9/27/1940,United States,1979,5,5,"Lawrence Bittaker (Lawrence Sigmund Bittaker) an American serial killer and rapists who along with his accomplice, Roy Lewis Norris are known as the Tool Box Killers. In 1979, Bittaker and Norris kidnapped, raped tortured and murdered five teenage girls over a period of five months in southern California. Bittaker and Norris used standard tools such as pliers, ice picks and sledgehammers to torture and murder their victims.","Rapist, Torturer, Strangler, Stalker",One of the Tool Box Killers
Arthur Gary Bishop,9/29/1952,United States,1979-1983,5,5,Arthur Gary Bishop Utah man who murdered five young boys; executed in 1988.,,
Hubert Pilcik,10/14/1981,Czech Republic,1948-1951,5,10,"Pilcik made money smuggling people across the Czechoslovakia-Germany border, he killed most of his customers. He would beat, rob, rape and shoot his victims. He was known to burn the remains of at least one of his victims. A 12-year-old girl was found belted to a torture structure constructed at Pilcik's home. Authorities found firearms and numerous other items that being to his victims during the search of his home. In 1951, Hubert Pilcik committed suicide in a prison in Plzen, Czech Republic.",Rapist,The Beast
Gary Charles Evans,10/7/1954,United States,1985-1997,5,5,"Gary Charles Evans an American serial killer who became friends with fellow inmate and infamous serial killer Son of Sam, David Berkowitz, during his time in Sing Sing Prison. Evan's was released from Sing Sing in 1984, he proceeded to burglarize and kill while in and out of jails for over 13 years. Aided investigators in a high-profile murder case before dodging parole. During an attempted escape Evan's committed suicide by jumping off the center of the Troy-Menands Bridge in New York.",Stalker,
Lesley Warren,10/15/1967,United States,1987-1990,4,8,"Warren was the oldest of two siblings he also had a half-sister and half-brother. He had been physically and psychologically abused since birth by his father. Warren received a sentence of death for killing Velma Gray, and the Asheville murders of Jayme Hurley and Katherine Johnson. Investigators believe that he is responsible for at least eight to ten other murders, all women. ","Rapist, Torturer, Strangler",The Babyface Killer
John Ingvar Lovgren,10/22/1930,Sweden,1958-1963,4,4,"He would assault, rape and beat his victims to death with a rock. Lovgren was never convicted for one of the murders and the case has since been closed, authorities consider the case solved with Lovgren as the assailant. In 1964, Lovgren was convicted for three of the murders and preventively detained at the Salberga psychiatric hospital, Salberga has been ran as a prison facility since 1997. In 2002, John Ingvar Lovgren died from complications with cancer.",Rapist,"Flickmördaren, The Girl Killer"
Ion Rîmaru,10/23/1971,Romania,1970-1971,4,4,"Rîmaru attacked 14 lone waitresses as they returned from work with a hammer, hatchet, knife or iron bar, always after midnight and under unusual weather (snowstorms, fog, hard rain, etc.). Rîmaru killed four women and attacked more than 10 others.",Vampire,The Vampire of Bucharest
Craig Price,10/11/1973,United States,1987-1989,4,4,"Price killed two women and two children in Rhode Island in the late 1980s. He committed his first murder at the age of 13 in 1987. In 1989, Price was 15-years-old, he murdered three of his neighbors. He was known to break into a home and stab his victims to death inflicting thirty to sixty-two wounds per victim. He was arrested a month before he turn 16-years-old, he was tried and convicted as a minor. During his incarceration Price was convicted of additional crimes and was sentenced to an additional 10-25 years. In 2019, Price was convicted for stabbing fellow inmate Joshua Davis, at the Suwannee Correctional Institution in 2017.",,The Warwick Slasher
William Clyde Gibson,10/10/1957,United States,2002-2012,3,3,"Gibson was known to rape strangle and stab his victims before mutilating their bodies and burying them in his back yard in New Albany, Indiana. Police found the third body while excavating Gibson's back yard, the victim was identified as a woman who had disappeared in 2012. At sentencing, Gibson responded ""I deserve what I’m getting. It ain’t no big deal.""","Rapist, Torturer, Strangler",
William Neal,10/7/1955,United States,1998,3,3,"Neal massacred three women with an axe. He was convicted of the brutal slayings of Rebecca Lynn Holberton, 44, Angela Fite, 28, and Candace Anita Walters, 48. The women, who all had relationships with Neal, were found dead at a gruesome crime scene in Holberton's townhome in 1998. He tied up a fourth victim, forced her to watch one of the murders and then raped her. He said that if he hadn't wanted to get caught, he would have murdered the women in the mountains and disposed of their bodies. By allowing the rape victim to live, he said, he was assured that ""her testimony alone could put me to the death-penalty phase"".",Rapist,Wild Bill Cody
Peter Bryan,10/3/1969,United Kingdom,1993-2004,3,3,"English serial killer cannibal and diagnosed paranoid schizophrenic. Bryan was preventively detained in a mental institution, Rampton Hospital, after killing a shop assistant with a hammer in 1993. Bryan was transferred to an open psychiatric ward at Newham General Hospital after psychiatrists noted his continued improvement. Upon his transfer in 2004, Bryan killed a friend and later confessed to dismembering the body and cooking the brain in butter and eating them. Bryan was held at Belmarsh prison and later transferred to Broadmoor Hospital where he killed a fellow mental patient, declaring that he did not eat him solely because he was caught first.","Cannibal, Strangler",
Michael Lee Lockhart,9/30/1960,United States,1987-1988,3,6," Lockhart received death sentences in three separate states Florida, Indiana, and Texas. He would rape stab and mutilate his victims, he shot at least one of his victims. Lockhart was convicted of the capital murder of police officer Paul Hulsey Jr. in Beaumont, Texas. He was also implicated in the sexual assault, murder and mutilation of 16-year-old Wendy Gallagher in Griffith, Indiana, 14-year-old Jennifer Colhouer in Land O' Lakes, Florida and the sexual assault of Lockhart's former wife in Toled. In 1997, Michael Lee Lockhart was executed by lethal injection at the Texas State Penitentiary at Huntsville, Texas.","Pedophile, Rapist, Torturer",The Perfect Gentleman
Richard Laurence Marquette,12/12/1934,United States,1961-1975,3,3,"Marquette was known to drain the blood, mutilate, dismember and scatter the remains of his victims. Marquette was the first person ever to be added as an eleventh name on the FBI Ten Most Wanted List for killing, mutilating and dismembering a woman in 1961.","Rapist, Strangler",Dick Marquette
Todd Kohlhepp,3/7/1971,United States,2003-2016,7,7,"In 2016, Kohlhepp was named as a person of interest in an unsolved 2003 bank robbery and triple homicide at the local Blue Ridge Savings Bank. In 2017, Kohlhepp pleaded guilty to seven counts of murder, two counts of kidnapping and one count of criminal sexual assault. On August 30th 2018 Kohlhepp's 96-acre property in Woodruff and more than 550 items were sold at a short-sale auction to the general public. The proceeds go to the family members of Kohlhepp's victims.",Rapist,Superbike Murderer
Peter Manuel,3/1/1927,United States,1956-1958,7,9,"Manuel was the one of the last prisoner to be hanged in Scotland, after a sensational trial in which he conducted his own defense. In 1958, Manuel was convicted of the murders of seven people, one murder case was thrown out of court and another was attributed to him but was never proven. In 1958, Peter Manuel was executed by hanging at Barlinnie prison in Glasgow, Scotland.","Rapist, Torturer",Beast of Birkenshaw
Sataro Fukiage,2/25/1889,Japan,1906-1924,7,7,"In 1906, Fukiage raped and murdered an 11-year-old girl. In 1923, Fukiage was arrested for molesting a four-year-old girl, but was later released. He raped and murdered six young girls, aged 11 to 16, between 1923 and 1924. He was arrested on July 28th 1924 and was sentenced to death by hanging in 1925.","Rapist, Strangler, Pedophile",Shinshumaro
Stanislaw Modzelewski,3/15/1929,Poland,1952-1967,7,8,"Modzelewski's victims were women aged between 18 and 87, he killed victims by strangling with a scarf or with his bare hands. At least one victim had razor blade like cuts on her buttocks. He was only convicted of seven murders because one victims body was never found. Modzelewski took valuable and other useless items from his victims. St","Vampire, Rapist, Strangler, Stalker",The Vampire of Galkowek
Christine Falling,3/12/1963,United States,1980-1982,6,6,Sentenced to life imprisonment in December 1982.,,Christine Laverne Slaughter
Ottis Toole,3/5/1947,United States,1961-1983,6,108,Toole confessed to killing more than a hundred people (108 Total) with his partner Henry Lee Lucas.,Cannibal,The Jacksonville Cannibal
Robert Joseph Zani,2/26/1944,United States,1967-1980,6,6,"Zani would typically shoot or beat his victims to death. Zani was born in 1944 as only child, who was sexually abused by his mother as a teenager. He attended school and attained good grades. It wasn’t until his first murder in 1967 that he had done anything notably illegal. Zani was arrested in 1980 for the murders of three of his victims. He was convicted of murder for two of his victims and second degree murder for killing his own mother on 1982. On March 31, 1986 the murder conviction for his mother was overturned.",,
Morris Solomon,3/15/1944,United States,1986-1987,6,7,"Solomon killed six young women between 1986 and 1987 in Sacramento, California. Solomon would bound, beat and rape his victims burying the body wrapped in bed sheets. He worked as a handyman in Sacramento, California. In 1987, Solomon was arrested after authorities found bodies buried at a residence associated with Solomon. He lived in his abandoned car which was parked on a lot at the residence.","Rapist, Strangler","Homicidal Handyman of Oak Park, The Sacramento Slayer"
Aileen Carol Wuornos,2/29/1956,United States,1989-1990,6,8,"Aileen Carol Wuornos an American serial killer who killed strangers, all men, along Florida highways over 13 months while working as a prostitute between 1989 and 1990. Wuornos claimed that her victims attempted to rape her while she was working as a prostitute, and that all of the homicides were committed in self-defense. The 2003 film Monster starred Charlize Theron as Wuornos.",,Monster
Stephen Richards,3/18/1856,United States,1878,5,9,"Stephen Richards (Stephen Dee Richards) an American serial killer who confessed to committing nine murders in Nebraska and Iowa between 1876 and 1878. Richards was convicted for the axe murder of the Harlson family, a woman and her three children, and for the murder of a neighbor of his. Stephen Richards was executed in 1879 by hanging in Minden, Nebraska.",,The Nebraska Fiend
Cathy Wood,3/7/1962,United States,1987,5,5,"Cathy Wood (Catherine May Wood) an American serial killer who along with her partner Gwendolyn Graham, known as the the Alpine Manor serial killers were convicted of killing five elderly women in Walker, Michigan, a suburb of Grand Rapids, in the 1980s. Graham and Wood turned the selection of victims into a game, choosing victims whose initials collectively spelled M-U-R-D-E-R. They committed their crimes in the Alpine Manor nursing home, where they both worked as nurse's aides. In 2013 Wood's posted an illegal online dating profile on Cowtowninfo.com in hopes of meeting someone new. As an inmate in Florida, Wood may have pen pals, but is prohibited from soliciting for pen pals. The profile has been taken down. On October 24th 2018 Wood's was granted early release for good behavior.",,One of the Alpine Manor serial killers
Colin Ireland,3/16/1954,United Kingdom,1993,5,5,"Ireland was a highly organized serial killer-- he picked passive masochist gay men in the Coleherne public house, accompanied them home, and murdered them after they were voluntarily restrained. Ireland carried a full murder kit of rope, handcuffs and a full change of clothes to each murder. He then cleaned the house of forensic evidence and left when he was sure of not appearing suspicious. In 1993, Ireland admitted all charges and was given life sentences for each. Colin Ireland died from pulmonary fibrosis on February 21st 2012 at Wakefield Prison in England.","Torturer, Strangler",The Gay Slayer
Timothy Wilson Spencer,3/17/1962,United States,1984-1987,5,5,,"Rapist, Strangler",The Southside Strangler
Faryion Wardrip,3/6/1959,United States,1984-1986,5,5,"Wardrip assaulted and murdered a total of five women around Wichita Falls, Texas between 1984 and 1986. He was convicted and sentenced to thirty-five years in prison for only one of the murders, he was released on parole in 1997. Wardrip was arrested and convicted in connection with the other murders in 1999. He was sentenced to death plus three life terms.","Rapist, Torturer, Strangler",The Wichita Falls Body Snatcher
Joseph Edward Duncan,2/25/1963,United States,1996-2005,5,7,"He was a child molester active between 1996 and 2005. Duncan was convicted of killing a California boy in 1997 and four members of an Idaho family in 2005. He confessed to two 1996 murders in Washington state, but has not been formally charged. Ducan would kidnap, rape and murder victims. Duncan maintained a personal website, entitled The Fifth Nail. He killed at least one victim by hitting them with a hammer. Joseph Duncan is currently on death row at USP Terre Haute in Terre Haute, Indiana.","Pedophile, Rapist, Torturer",The Fitth Nail
William Patrick Fyfe,2/27/1955,Canada,1979-1999,5,9,"William Patrick Fyfe a Canadian serial killer and rapist known as The Killer Handyman. Fyfe was convicted of killing five women in the Montreal area of Quebec. He was sentenced to life in prison in 2001. Fyfe made confession to four additional murders in exchange for obtaining a transfer from a Quebec prison to a prison in Western Canada. Authorities say Fyfe will not be tried for the four new murders, because he is already serving a life sentence, the maximum under the law. William Patrick Fyfe is currently serving his sentence at the Saskatoon prison in Western Canada.",Rapist,The Killer Handyman
Léopold Dion,2/25/1920,Canada,1963,4,4,"Léopold Dion a Canadian sex offender and serial killer known as the Monster of Port-Rouge. Dion was active in Quebec. He was sentenced to death by hanging. Léopold Dion was stabbed to death on November 17th 1972 by fellow inmate named Normand ""Lawrence d'Arabie"" Champagne, who was found not guilty by reason of insanity.",,Monster of Port-Rouge
John Straffen,2/27/1930,United Kingdom,1951-1952,3,3,"John Straffen (John Thomas Straffen) an English serial killer who killed two young girls in the summer of 1951. Straffen killed his third victim after escaping from the mental hospital where he was being held for the first two murders. Straffen's sentence was commuted to life imprisonment at Frankland Prison in County Durham, England. John Straffen died at Frankland Prison in 2007 at the age of seventy-seven. He had been in prison for a British record of fifty-five years and is currently the longest-serving prisoner in British legal history. Straffen taking the record from fellow serial killer Ian Brady.",Strangler,Longest-serving prisoner in British legal history
Juan Covington,3/3/1962,United States,1998-2005,3,3,Covington shot and killed three victims between 1998 and 2005. Juan Covington was arrested in 2005 after security camera footage linked him to the murder of co-worker at the Pennsylvania Hospital in Philadelphia.,,
Robert Napper,3/25/1966,United Kingdom,1992-1993,3,3,"Napper would rape, smother, stab and mutilate his victims.Napper was suspected of up to seventy other violent sexual attacks in South East London attributed to the unidentified Green Chain rapist. In 1994, Napper was arrested after his fingerprint was recovered from a 1993 crime scene. One of his victims was so badly mutilated that a police photographer was put into therapy for two years. In 2008, Robert Napper was convicted of the manslaughter and on the grounds of diminished responsibility was preventively detained at the Broadmoor Hospital in Berkshire, England.","Rapist, Stalker","Green Chain Rapist, The Plumstead Ripper"
Albert Fish,3/19/1870,United States,1924-1932,3,9,"Albert Fish (born Hamilton Howard Fish) an American serial killer and child rapist who was convicted and executed for the kidnapping, rape murder and cannibalization of three children in New York, suspected of the deaths of six more children and teenagers. Likely insane (though his insanity plea was denied to make possible his execution), Fish boasted that he ""had children in every state"" and at one point claimed 100 victims. Fish would drink the blood of his victims. Detective William King believed Fish was a suspect in the Brooklyn vampire case but Fish denied any involvement.","Pedophile, Rapist, Vampire, Cannibal, Torturer, Stalker","Gray Man, Werewolf of Wysteria, The Boogey Man"
Tiago Gomes da Rocha,2/4/1988,Brazil,2011-2014,39,39,"Tiago Gomes da Rocha confessed to the murders of thirty-nine people. He approached his victims on a motorbike and shouted ""robbery"" before shooting them. However, Rocha never took anything from his victims. He targeted homeless people, women and homosexuals in Goiás, Brazil. During his confessing to the murders he claimed his cravings to kill started when he was sexually abused as a child and the urge only got more intense when women romantically rejected him as he grew older. At the time of his crimes he was living with himself, alone in Goiania, Brazil,",Strangler,Goiania Serial Killer
Robert Christian Hansen,2/15/2939,United States,1971-1983,15,21,"Robert Christian Hansen kidnapped prostitutes and then would release them into the Alaska wilderness so Hansen could hunt them down like game animals. Based on discovered remains, police suspect him of six murders in addition to the fifteen for which he was convicted. An aviation map with x marks, was found hidden behind Hansen's headboard. Police later learned the x marks were locations of victims bodies.  At the time of his crimes he was living with his second wife and their two children.","Rapist, Torturer, Stalker",The Butcher Baker
Boone Helm,1/28/1828,United States,1850-1864,11,11,"Boone Helm was a mountain man and gunfighter of the American West. In 1850, Helm stabbed his cousin after asking him to accompany Helm to California. On the way, he murdered several men in various altercations, eventually committing premeditated murder. In 1862 after heavy drinking Helm gunned down an unarmed man. Helm was apprehended in Montana.",Cannibal,The Kentucky Cannibal
Vickie Dawn Jackson,2/13/1966,United States,2000-2001,10,20,"The North Texas hospital where Vickie Dawn Jackson worked as a nurse was plagued by a rash of respiratory deaths, the deaths were not considered suspicious – until administrators realized vials of mivacurium chloride, a powerful drug used to temporarily paralyze a patient's ability to breathe, had gone missing. Investigators eventually focused on Jackson after the hospital administration realized that she'd been the last one in the dead patients' rooms. One of the victim was her husband's grandfather. At the time of her crimes she was living with her husband and children, then alone at a house on Henrietta Street, Nocona, Texas, US.",N/A,Angel of Death
Dale Hausner,2/4/1973,United States,2005-2006,8,8,"Dale Hausner was part of the Serial Shooters of Phoenix, Arizona. The group was responsible for at least eight murders and 29 to 38 other drive-by shootings in 2005 and 2006. Dale Hausner and Samuel Dieteman were arrested in 2006 for the crimes, and are also thought to have been responsible for setting two Wal-Mart stores ablaze in June of 2006. At the time of his crimes he was living with Samuel Dieteman.",N/A,The Serial Shooters
William Devin Howell,2/11/1970,United States,2003,7,7,"William Howell was convicted of murdering seven people in 2003. Howell cut off the tips of a victims fingers and dismantled the bottom jaw at least one of his victims. One of his victims was strangled to death after Howell realized the victim was transgender during a sexual act. He disposed some of the bodies in a wooded area behind a shopping mall in New Britain, Connecticut.","Rapist, Strangler",Sick Ripper
Emile Louis,1/21/1934,France,1975-1978,7,7,"Emile Louis was a bus driver that preyed on young handicapped women (seven murders) in the 1970s. Louis confessed to the murders, later retracting his confession. Louis was sentenced to life in prison on November 25th 2004.",N/A,le boucher de l'Yonne
Friedrich Schumann,2/1/1893,Germany,1918-1919,6,6,"Friedrich Schumann murdered at least six victims in Germany between 1918 and 1919. Schumann would target couples hiking in the Falkenhagener forest near the lake. He would rob and shoot his victims, raping the female victims. Schumann had numerous other charges including multiple charges of rape where the victim was not murdered. He was executed on August 27th 1921",Rapist,Massenmörder vom Falkenhagener (The Mass Murderer of Falkenhagen Lake)
