Name,Birthday,CountriesActive,YearsActive,ProvenVictims,PossibleVictims,Notes,Type,Nickname
Harold Shipman,1/14/1946,United Kingdom,1975-1998,218,250,"Convicted of 15 murders and responsible for the deaths of 218 patients identified by inquiry but is believed to have killed up to 250 people. He injected diamorphine into his patients and then falsified the medical records, reporting that his patient had been in poor health. Hanged himself in prison.",Medical,Dr Death Angel of Death
Miyuki Ishikawa,,Japan,1940s,103,169,Killed more than 103 newborn children. As a maternity nurse she killed infants born to parents unwilling to care for them during the prohibition of abortion in Japan. Arrested in 1948 and sentenced to four years in prison.,Medical,
Niels Högel,12/30/1976,Germany,1999-2005,100,300,"Nurse who was sentenced to life imprisonment for the murder of more than 85 people. In November 2017, German prosecutors said that the number of victims was at least 106, with Högel admitting, in October 2018, to murdering 100 patients. By May 2019, he was believed to be the most prolific serial killer in peacetime Germany with up to 300 victims over fifteen years.",Medical,
Louay Omar Mohammed al-Taei,,Iraq,2005-2006,43,0,"Medical doctor found to have killed 43 wounded policemen, soldiers and officials in Kirkuk; was a member of an insurgent cell.[303]",Medical,
Donald Harvey,4/15/1952,United States,1970-1987,37,77,Self-professed Angel of Death. Worked as an orderly in Cincinnati-area hospitals and preyed on his patients. Claimed to have killed 87 patients starting at age 18. Active 1970–1987. Sentenced to 28 life sentences in Ohio.,Medical,Angel of Death
Jane Toppan,3/31/1854,United States,1885-1901,31,0,Nurse that confessed to poisoning 31 patients for her own sexual gratification. After overdosing them she would get in bed and lie with them as they died. Found not guilty by reason of insanity and interned in a mental institution until her death in 1938.,Medical,"Angel of Death, Jolly Jane"
Stephan Letter,9/17/1978,Germany,2003-2004,29,29,Nurse who killed 29 patients; sentenced to life imprisonment in 2006.,Medical,
Anders Hansson,,Sweden,1978-1979,27,,"A Nurse Aide who poisoned victims with gevisol and ivisol. His actions were called ""The Hospital Murders"" (Swedish: Sjukhusmorden).",Medical,
Marcel Petiot,1/17/1897,France,1926-1944,26,63,Active 1926 and from 1942 to 1944. Petiot is suspected of having killed up to 63 in total. Executed in 1946. Petiot was a doctor who formerly served as mayor of Villeneuve-Sur-Yonne. Dr. Mike Aamodt from Radford University states he had an IQ of 130.,Medical,"Captain Valery, Docteur Satan"
Arnfinn Nesset,10/25/1936,Norway,1983 and earlier,22,32,"Norwegian nurse and most prolific known serial killer in Scandinavian history, convicted in 1983 of poisoning at least 22 patients with Curacit; however he initially confessed to 27 murders; later he retracted his confessions and claimed he had killed 138 patients. Was released from prison in 2004 after serving 21 years, the maximum punishment possible by Norwegian law.",Medical,
Roger Andermatt,,Switzerland,1995-2001,22,22,Nurse who killed 22 patients; most prolific Swiss serial killer in history; sentenced to life imprisonment.,Medical,Death-Keeper of Lucerne
Charles Cullen,2/22/1960,United States,1988-2003,29,217,"Charles Edmund Cullen an American serial killer worked as a nurse in many hospitals but kept switching jobs as he was fired for suspicious behaviour from many of them. He confessed to murdering 40 elderly patients in New Jersey from 1984 to 2003. He did this by poisoning his patients to death with unprescribed medication. Some have estimated that Cullen may ultimately be responsible for 400 deaths, which would make him the most prolific serial killer in recorded history.",Medical,Angel of Death
Sonya Caleffi,7/21/1970,Italy,2003-2004,5,18,Nurse who poisoned terminally-ill patients; sentenced to 20 years imprisonment.[312],Medical,
Maxim Petrov,11/14/1965,Russia,2000-2002,12,19,Doctor who killed his patients in St. Petersburg. Suspected of 19 murders.,Medical,
Ann Arbor Hospital Killer,,United States,1975,10,10,Poisonings of 10 patients at the Veteran's Administration Hospital in 1975. Filipino nurses Filipina Narciso and Leonora Perez were tried for the crimes.,Medical,
Ludivine Chambet,5/10/1983,France,2012-2013,10,10,Nurse's aide who poisoned elderly patients; sentenced to 25 years imprisonment.,Medical,The Poisoner of Chambéry
Petr Zelenka,2/27/1976,Czech Republic,2006,7,21,Killed his victims with a lethal injection of heparin from May to September 2006. Ten people survived his murder attempt. Suspected of up to 14 additional murders.,Medical,
Orville Lynn Majors,4/24/1961,United States,1993-1995,6,130,"LPN in Vermillion County Ind., Preyed on elderly patients—thought to have killed many of them with injections of potassium chloride. Sentenced to 360 years in Indiana.",Medical,
Efren Saldivar,9/30/1969,United States,1989-1997,6,50,"Respiratory therapist who killed six patients, possibly as many as 120.[318]",Medical,
Christine Malèvre,1/10/1970,France,1998 and earlier,6,30,"Nurse who killed terminally ill patients claiming that they had asked her to help them die, something denied by their families. Sentenced to 12 years in prison for six murders and suspect of 30.",Medical,
Antoinette Scieri,,France,1924-1925,6,12,Nurse who poisoned her elderly patients. Death sentence was commuted to life in prison and she died in prison.,Medical,
Kristen Gilbert,11/13/1967,United States,1990-1996,5,70,"Nurse at a Massachusetts Veterans Medical Center who injected male patients with epinephrine, causing heart attacks. Sentenced to life without parole.",Medical,
Amy Archer-Gilligan,10/31/1873,United States,1910-1917,5,48,"A nursing home proprietor believed to have poisoned as many as 60 patients from her homes and her second husband. Charged with five murders originally, this was lowered to just one following her admission of guilt, and was found guilty of second degree murder. Died in a mental hospital in 1962.",Medical,"Amy E. Duggan, Sister"
Michael Swango,10/21/1954,United States Zimbabwe,1981-1997,4,47,Medical Doctor who killed patients.,Medical,
Kermit Gosnell,2/9/1941,United States,1989?-2011,4,100,"Gosnell, who ran an abortion clinic, was charged with eight and convicted of four murders. Three babies were born alive, then killed by cutting the infant's spine with scissors. One mother died due to complications. Testimony indicated hundreds of similar procedures carried out by Gosnell and his staff.",Medical,
Edson Izidoro Guimarães,,Brazil,1999 and earlier,4,131,"Nurse who injected patients with potassium chloride or removed their oxygen mask. Confessed to five murders which he claimed to be mercy killings and was convicted of four in 2000; sentenced to 76 years in prison. He may have killed as many as 131 patients for money, as he was paid $60 for informing local funeral homes of a patient's death so that they could contact the deceased's relatives first.",Medical,
Richard Angelo,8/29/1962,United States,1987,4,25,"New York nurse convicted of four murders, linked to six other deaths. Suspected of killing up to 25 people.",Medical,The Angel of Death
Beverley Allitt,10/4/1968,United Kingdom,1991,4,,Convicted of murdering four children and attacking another six in the Lincolnshire hospital where she worked as a nurse. Given 13 life sentences.,Medical,
Andrés Ulises Castillo Villarreal,,Mexico,2009-2015,3,12,"Drugged, raped and then killed men in Chihuahua; sentenced to 120 years imprisonment.","Medical, Rapist",The Chihuahua Ripper
Elfriede Blauensteiner,1/22/1931,Austria,1981-1995,3,10,Poisoned people for material gain; died from a brain tumor in 2003.,Medical,The Black Widow
Carl Eugene Watts,11/7/1953,United States,1974-1982,14,80,"Believed to have killed over 80 women in multiple states, in 1982 Watts accepted a plea bargain in Texas in which he would plead guilty to a lesser charge and be granted immunity from murder charges in exchange for providing information on his victims; as a result he confessed to 12 murders and was sentenced to 60 years in prison on the lesser charge. He was sentenced to life imprisonment in separate trials in Michigan in 2004 and 2007, and died of cancer a week after the 2007 sentence was handed down.","Serial Killer, Strangler, Stalker","Coral Watts, The Sunday Morning Slasher"
Philipp Tyurin,,Soviet Union,1945-1946,14,29,Murdered people for monetary reasons at his hut in Leningrad; executed 1947.,,"Leningrad Maniac, The Hellraiser"
Zdzisław Marchwicki,10/18/1927,Poland,1964-1970,14,21,"Killed 14 women in 1964–1970 in Poland's region of Dąbrowa Basin. Zdzisław Marchwicki was most likely the man responsible for the killings; however, his guilt remains in dispute. Executed in 1977.",,Vampire of Zagłębie
Pietro Pacciani,,Italy,1968-1985,14,16,"Unidentified killer who shot couples in lovers lanes and mutilated the women, taking their sexual organs and in the last two cases, also their left breast. 69-year-old farmer Pietro Pacciani was controversially convicted of 14 crimes in 1994 and sentenced to life in prison, but he was released following allegations that the scant evidence had been planted in an attempt to close the case, which was by then the largest and most mediatic in Italy's criminal history. Pacciani was scheduled for retrial in 1998 when he died after taking medication contraindicated to his heart problems. Pacciani's two alleged accomplices, Mario Vanni and Giancarlo Lotti, were sentenced to life and 30 years in prison, respectively. Some believe that none of the accused were guilty, and that Lotti incriminated himself and the other two because he was homeless and wanted to live in prison.",,The Monster of Florence
Joachim Kroll,4/17/1933,West Germany,1955-1976,14,,Died from a heart attack in prison in 1991.,"Cannibal, Strangler, Rapist, Necrophiliac","Ruhr Cannibal, The Duisburg Man-Eater"
Arthur Shawcross,6/6/1945,United States,1972-1989,14,,"Committed arson and burglary, served two years of a five-year sentence. Within a year of his release, he raped and murdered two children in 1972. Under a plea bargain, he was sentenced to 25 years. Released after serving 141/2 years, he began killing again a year later, targeting prostitutes. He strangled and battered his victims. Sentenced to life without parole. Died of cardiac arrest in 2008.",Strangler,"Genesee River Killer, Genesee River Strangler, Rochester Strangler, Monster of the Rivers"
The Doodler,,United States,1974-1975,14,,"Unidentified serial killer who sketched then stabbed to death 14 gay men in San Francisco. Surviving victims did not wish to testify, so the killer was not identified.",,
Marcelo Costa de Andrade,1/2/1967,Brazil,1991,14,,Raped and killed 14 children in Rio de Janeiro and Niterói. Drank the blood of his victims. Found not guilty by reason of insanity.,"Vampire, Rapist, Pedophile, Necrophiliac",The Vampire of Niterói
Julio Pérez Silva,7/15/1963,Chile,1998-2001,14,,Killed 14 women. Sentenced to life imprisonment in 2004.,,The Psychopath from Alto Hospicio
Sergey Shipilov,5/17/1959,Russia,1995-1999,14,,"Killed female hitchhikers in the town of Velsk, most of them while out on prison leave; sentenced to life imprisonment.",,Velsk Chikatilo
Abdufatto Zamanov,4/7/1973,Russia,2002-2004,14,,Killed people out of personal hostility; also raped two young girls; sentenced to life imprisonment.,Rapist,
Jeong Nam-gyu,3/1/1969,South Korea,2004-2006,14,,"Kidnapped, raped and murdered people; committed suicide.",Rapist,
Amir Qayyum,,Pakistan,2005,14,,Killed 14 homeless men with rocks or bricks when they were asleep. Sentenced to death in May 2006.,,The Brick Killer
Jake Bird,12/14/1901,United States,1930s-1947,13,44,"Bird had an extensive criminal record including burglary and attempted murder. Bird was arrested in 1947 and was sentenced to death for the murders of two victims. In 1948, Bird was scheduled for execution but it was postponed when he confessed to a total of forty-six murders. Eleven of the forty-six victims were substantiated and he was considered a prime suspect in the remaining crimes. In 1949, Jake Bird was executed by public hanging at Washington State Penitentiary in Walla Walla, Washington.","Rapist, Stalker",The Tacoma Ax-Killer
Belle Gunness,11/22/1859,United States,1900?-1908?,13,40,"Norwegian-born murder-for-profit killer who murdered her suitors and relatives in Indiana. High possibility of committing over 40 murders. May have faked her own death in the fire that destroyed her home in 1908; her children had died of strychnine poisoning before the fire, and the woman's body found next to them was decapitated and, reportedly, smaller than Gunness' own. Ultimate fate unknown.","Strangler, Stalker","Hell's Belle, Brynhild Paulsdatter Størseth"
Cleveland Torso Murderer,,United States,1934-1938,13,40,"Unidentified serial killer, also known as ""The Mad Butcher of Kingsbury Run"", who targeted drifters and derelicts, of whom only two were identified, between 1934 and 1938 in Cleveland, Ohio.[134]",,
Kaspars Petrovs,,Latvia,2003,13,38,"Confessed to strangling 38 elderly residents of Riga, Latvia, in 2003. Convicted and sentenced to life imprisonment for the robbery and murder of 13.",,
Richard Ramirez,2/29/1960,United States,1984-1985,13,20,"Killed 13 people between 28 June 1984, and 24 August 1985, in Los Angeles.Ramirez used a wide variety of weapons, including handguns, knives, a machete, a tire iron, and a hammer. Richard Ramirez was captured as a crowd of bystanders surrounded him, beat him, and held him until police arrived to arrest him. Ramirez was sentenced to death in 1989, and died of B-cell lymphoma in 2013 while still on death row.","Rapist, Torturer, Strangler, Stalker",Night Stalker
Sleepy Hollow Killer,,South Africa South Africa,1990s-2007,13,16,"Raped and murdered women, mostly sex workers, around Pietermaritzburg and the Midlands of KwaZulu-Natal.",Rapist,
Peter Sutcliffe,6/2/1946,United Kingdom,1975-1980,13,15,"Killed 13 women between 30 October 1975, and 17 November 1980. Most victims were killed by a combination of bludgeoning and stabbing, and all but two were killed in the county of Yorkshire. Owing to the modus operandi and location of the murders, Sutcliffe became known as the ""Yorkshire Ripper."" Sentenced to 20 concurrent life sentences. After three years he was sent to a secure psychiatric facility, where he served 25 years before being found ""fit to leave"" in 2009. Government officials and courts ruled in 2010 that he will never be released. In 2015, he was declared ""no longer mentally ill,"" and transferred to a maximum security prison.",,Yorkshire Ripper
Francisco Antonio Laureana,,Argentina,1974-1975,13,13,"Raped 15 women in San Isidro, killing 13 of them. Shot and killed during a firefight with police.[140]",,
Tamara Samsonova,4/25/1947,Russia,1995-2015,13,13,Killed and allegedly cannibalized people in her apartment; committed to a psychiatric clinic.,Cannibal,"Granny Ripper, Baba Yaga"
Herbert Mullin,4/18/1947,United States,1972-1973,13,,"Despite detailed confessions, prosecutors decided not to try him for the first three crimes, instead focusing on crimes that conflicted with his insanity plea. Sentenced to imprisonment for life.",,The Psychopath of Santa Cruz
Albert DeSalvo,,United States,1962-1964,13,,"Although Albert DeSalvo was widely thought to be the Boston Strangler, police and others analysing the case have long doubted the truth of his confession. Sentenced to life for a series of rapes, he was murdered in prison. DeSalvo's body was exhumed for DNA testing, and compared to a substance found on the exhumed body of the Boston Strangler's last victim. In 2001, it was declared not to match, but in 2013 officials announced that improvements in DNA extraction technology produced viable samples from the degraded evidence. DeSalvo's body was reexhumed and found to match.","Rapist, Strangler",Boston Strangler
Lorenzo Gilyard,5/24/1950,United States,1977-1993,13,,Killed up to 13 prostitutes in the Kansas City area from 1977 to 1993. Sentenced to life in 2007.,Strangler,The Kansas City Strangler
Vladimir Storozhenko,,Soviet Union,1978-1981,13,,Tortured and murdered women for sexual pleasure; four other inncent men were initially convicted for his crimes; executed 1984.,"Strangler, Torturer",Smolensky Strangler
Vasiliy Kulik,1/17/1956,Soviet Union,1984-1986,13,,Killed at least 13 victims from 1984–1986. Executed by firing squad in 1989.,,The Irkutsk Monster
Nikolai Dudin,12/22/1973,Soviet Union Russia,1987-2002,13,,"Killed his father in 1987, and after release, killed 12 more people while intoxicated; sentenced to life imprisonment.",,The Grim Maniac
Denis Pischikov,3/12/1983,Russia,2002-2003,13,,Robbed and killed elderly people around the Moscow Oblast and Vladimir Oblast; sentenced to life imprisonment.,,The Shivering Creature
Nikolay Shubin,,Russia,2004-2006,13,,Paranoid schizophrenic who killed people who beat him in chess games; sentenced to compulsory treatment.,,
Johannes Mashiane,,South Africa,1982-1989,13,,He was found guilty of 13 counts of murder and 12 counts of sodomy from 1982–1989. Committed suicide by throwing himself under a bus while being pursued by police in 1989.,,The Beast of Atteridgeville
Mukosi Freddy Mulaudzi,,South Africa South Africa,1990-2006,13,,"Escaped convict, originally responsible for two murders, who murdered 11 more after his prison escape; given 11 life sentences.",,The Limpopo Serial Killer
Thozamile Taki,,South Africa,2007,13,,He murdered 13 women. Convicted in 2010.,,Sugar cane serial killer
Rainbow Maniac,,Brazil,2007-2008,13,,"Unidentified serial killer who shot gay men in the head (except one, who was bludgeoned) in the Paturis Park of Carapicuiba.",,
Naceur Damergi,,Tunisia,1980s-1988,13,,Raped and killed minors in the Nabeul region; executed by hanging in 1990.[155],,
Adolf Seefeldt,3/6/1870,German Empire Weimar Republic Nazi Germany,1908-1935,12,100,"Sexually abused young boys in their sleep, then poisoned them; suspected of 100 murders in total.[156] Executed by guillotine in 1936.",Pedophile,The Sandman
Donald Henry Gaskins,3/13/1933,United States,1953-1982,12,55,Gaskins was convicted of nine murders committed in South Carolina between 1973 and 1975. He was suspected of 31 murders. Two victims had been murdered while Gaskins had been incarcerated—one while Gaskins had been on death row. Later claimed on death row that he had murdered between 80 and 110 victims. Executed by electric chair in 1991.,,"The Meanest Man in America, Pee Wee"
William Suff,8/20/1950,United States,1986-1992,12,22,"Previously served 10 years of a 70-year sentence for beating his baby daughter to death. Beginning two years after his release, this county store clerk raped, stabbed, strangled, and sometimes mutilated 12 or more prostitutes in Riverside County, California. Known as the ""Riverside Prostitute Killer"" and the ""Lake Elsinore Killer."" Sentenced to death.[158]","Rapist, Torturer, Strangler","Riverside Prostitute Killer, Lake Elsinore Killer"
Vladimir Romanov,,Soviet Union Russia,1991-2005,12,20,Pedophile who raped and murdered girls and young women in the Kaliningrad Oblast; committed suicide while imprisoned.,"Pedophile, Rapist",The Kaliningrad Maniac
Maury Travis,10/25/1965,United States,2000-2002,12,17,"He killed prostitutes in the St. Louis area from 2000 to 2002. Travis was caught when he mailed an Expedia.com map printout to a St. Louis newspaper, police traced the printout to Travis' home computer. He claimed to have murdered seventeen women in a letter sent with the map. Investigators discovered a chamber at his residence which included instruments of torture and videotapes of Travis committing some of his crimes. Maury Travis committed suicide in his jail cell, after being arrested for murder on June 7th 2002.","Serial Killer, Torturer, Strangler",The Video Strangler
Dennis Nilsen,11/23/1945,United Kingdom,1978-1983,12,15,"Nilsen murdered and dismembered young men in London between 1978 and 1983. Nilsen observed a ritual in which he bathed and dressed the victims' bodies before dissecting and disposing of the remains. He kept various body parts around his home for an extended amount of time. Nilsen died at York Hospital in 2018 while still in custody. He had been transferred to the hospital after complaining of stomach pains, during surgery a blood clot ended his life.","Necrophiliac, Strangler, Rapist","The Muswell Hill Murderer, the Kindly Killer"
Kenneth Bianchi,5/22/1951,United States,1977-1978,12,15,"Convicted of strangling 12 female victims aged 12 to 28 and suspected in another three cases. One of the ""Hillside Stranglers"". Sentenced to imprisonment for life.","Strangler, Rapist, Torturer, Stalker","One of the ""Hillside Stranglers"""
Charles Sobhraj,4/6/1944,Thailand   Nepal India Malaysia,1975-1976,12,13,"French con man that targeted Western tourists in vacation spots of South-east Asia, often with the help of female accomplices. Imprisoned in India from 1976 to 1997, and from 2004 serving a life sentence in Nepal.",,"The Bikini Killer, The Serpent"
Abdallah al-Hubal,,Yemen,1990-1998,12,,"Killed seven people after a Yemeni reunion; fled prison, then proceeded to kill a young couple and three more people; killed during a shootout with police.",,
Nikolai Shestakov,,Soviet Union,1975,12,,Truck driver who raped and killed girls and young women; supposedly executed in 1977.,Rapist,The Luberetsky Maniac
Anatoly Sedykh,4/20/1963,Russia,1998-2003,12,,"Raped and killed women around Lipetsk, then robbed their corpses; sentenced to life imprisonment.",Rapist,
Joseph Christopher,7/26/1955,United States,1980-1981,12,,"Racist who killed 12 people, all but one of them African Americans, in 1980 and 1981, between upstate New York and Georgia, mutilating two of them. Sentenced to life imprisonment, died in prison age 33 of breast cancer.",,The Midtown Slasher
"""Paraquat murders"" killer",,Japan,1985,12,,Unidentified serial killer who carried out a series of indiscriminate poisonings in Japan in 1985 that killed 12.,,
Enriqueta Martí,2/2/1868,Spain,1900-1912,12,12,"Self-proclaimed witch that abducted, prostituted, murdered and made potions with the bodies of small children that she sold in Barcelona. Remains of 12 different children were identified in her home, but she is believed to have murdered more. Murdered in prison by fellow immates while awaiting trial in 1913.",Vampire,"The Vampire of Barcelona, The Vampire of the Raval"
Herb Baumeister,4/7/1947,United States,1990-1996,13,25,Strangled gay men and buried their bodies in his backyard in Indiana and Ohio; 11 men were found in the yard but only five were identified. Committed suicide by shooting himself when faced with arrest.,"Strangler, Torturer",The I-70 Strangler
John Bunting,,Australia,1992-1999,11,,Ringleader in the Snowtown murders (aka Bodies in the Barrels Murders); sentenced to 11 consecutive life sentences without the possibility of parole.,,
Sergey Golovkin,11/26/1959,Soviet Union Russia,1986-1992,11,40,Killed at least 11 boys in the Moscow area between 1986 and 1992. Executed by gunshot in 1998; last person executed in Russia before the death penalty was abolished.,"Rapist, Necrophiliac, Torturer, Strangler","The Fisher, The Boa"
Juana Barraza,12/27/1957,Mexico,late 1990s-2006,11,39,Female wrestler who bludgeoned or strangled elderly women to rob them. Sentenced to 759 years.,"Rapist, Strangler","La Mataviejitas, The Old Lady Killer"
Zhang Yongming,,China,2008-2012,11,18,Sold flesh of his victims as 'ostrich meat' and kept eyeballs in wine. Executed.,"Cannibal, Strangler","The Cannibal Killer, the Cannibal Monster of Yunnan"
Jack Unterweger,8/16/1951,Austria United States Czechoslovakia,1974-1992,11,15,"Served 14 years in Austrian prison because of a murder in 1974; killed at least nine prostitutes after his release. Was a small media star in Austrian media in the early 1990s and, on behalf of Austrian police, was arrested in the US, where he may have killed another three prostitutes. Hanged himself in 1994 after being sentenced to life in prison.","Rapist, Strangler","Jack the Writer, Häfenliterat"
Vaughn Greenwood,,United States,1964-1975,11,13,"Killed 11 people, suspected of two more. Cut victims' throats from ear to ear and may have drank their blood. Sentenced to imprisonment for life.",Vampire,Skid Row Slasher
Benjamin Atkins,8/26/1968,United States,1991-1992,11,,"Raped and strangled his victims before abandoning their bodies in vacant buildings. Died in prison in 1997, age 29, from AIDS.","Rapist, Strangler",The Woodward Corridor Killer
Nannie Doss,11/4/1905,United States,1927-1954,11,,"Doss' preferred method of killing was poisoning by arsenic. She killed four husbands, two children, her two sisters, her mother, a grandson, and a mother-in-law. Her husband, Samuel Luther Doss, died on October 12th 1954. Doss pled guilty on May 17th 1955, and was sentenced to life imprisonment. Nannie Doss died from leukemia in the hospital ward of the Oklahoma State Penitentiary on June 2nd 1965.",,"Giggling Nanny, Giggling Granny, Jolly Black Widow"
Clifford Olson,1/1/1940,Canada,1980-1981,11,,"Considered a dangerous offender, meaning that Olson could never have been released from prison. He had three parole applications rejected. Died from cancer in 2011.","Rapist, Strangler",The Beast of British Columbia
